{
  "schema_version": "1.1",
  "offline_mode": true,
  "offline_note": "Local triage only. Source data never leaves the office.",
  "agent_id": "agent01.helpdesk.defendable.eth",
  "agent_ens": "agent01.helpdesk.defendable.eth",
  "agent_name": "AO Help-Desk Support Agent",
  "host": "defendableos-baremetal-02",
  "symptom": "stopped replying to tickets around 08:10",
  "vitals_status": "alive",
  "vitals_probe": null,
  "pulse_status": "ok",
  "bloodwork_findings": [],
  "neuro_findings": [],
  "recent_changes": [],
  "last_known_good": {
    "timestamp": "2026-05-25T22:00:00Z",
    "model": "Atlas-Qwen-27B",
    "adapter": "helpdesk-v3",
    "deploy": "deploy 2026-05-25 22:00 (green)"
  },
  "metrics": {
    "heartbeat_success_rate": 1.0,
    "error_rate": 0.0,
    "successful_probe_count": 5,
    "consecutive_failures": 0,
    "latency_ms": 1400.0,
    "gpu_memory_used_pct": 0.6666666666666666,
    "context_tokens_pct": 0.390625,
    "stability_score": 100.0
  },
  "findings": [],
  "hard_faults": [],
  "soft_warnings": [],
  "root_cause_category": "none",
  "diagnosis": "Agent healthy across vitals, pulse, bloodwork, and neuro. Stable.",
  "diagnosis_confidence": 0.95,
  "treatment_plan": [
    "No treatment needed. Stable."
  ],
  "time_to_recovery_minutes": 0,
  "human_required": false,
  "discharge_status": "DISCHARGE_TO_EVAL_CURATOR",
  "ready_for_eval_curator": true,
  "continuity_action": null,
  "timestamp": "2026-05-26T12:42:27.247802+00:00",
  "receipt_sha256": "f64227f99f142cb4909c14dc915737a86bb2f2a6180111edd84ff480a46a2f66"
}